tool,language,audio_file,original_text,transcribed_text,wer,cer,word_accuracy,char_accuracy,whisper_model,timestamp
sarvam,tamil,tamil_46.wav,படுக்கையறை AC இல் சைல்ட் லாக் ஆன் செய்யவும்.,யோகரும் ஏசிவனில் ஊமிகான முடு அன்சையவும்,1.0,0.6818,0.0,31.82,base,2026-03-05T11:29:23.822005+00:00
sarvam,tamil,tamil_47.wav,ஆபிஸ் AC 2 இல் ஃபேன் வேகத்தை ஹை ஆக அமைக்கவும்.,படுக்கையாக ஏ சில் செல்லாக மொடு வாவ செய்யவும்,1.0,0.7609,0.0,23.91,base,2026-03-05T11:29:25.685316+00:00
sarvam,tamil,tamil_48.wav,படுக்கையறை AC இல் ஹாரிசொண்டல் ஸ்விங் ஆட்டோ ஆக அமைக்கவும்.,படுக்காக ஏசில்லிக்கும் முடன் செய்வும்,1.0,0.6491,0.0,35.09,base,2026-03-05T11:29:27.646276+00:00
sarvam,tamil,tamil_49.wav,லிவிங் ரூம் AC 2 இல் வெப்பநிலையை 30 டிகிரியாக அமைக்கவும்.,"படக்கையாக ஏசி, இல்லையிட்ணன் செடிலோ ஆகாமைக் காவும்",1.0,0.7018,0.0,29.82,base,2026-03-05T11:29:29.526445+00:00
sarvam,tamil,tamil_5.wav,யோகா ரூம் AC 1 ஐ ஆன் செய்து அதன் ஸ்விட்ச் ஆஃப் டைமரை 20 நிமிடமாக அமைக்கவும்.,படுக்காய் ஏற்புறிப் பிறிப்பாக ஒன்றில் லிடி பிறக்ணாஸ் போட்டியாக மக்க்கும்,1.0,0.7632,0.0,23.68,base,2026-03-05T11:29:43.679125+00:00
sarvam,tamil,tamil_50.wav,யோகா ரூம் AC 1 இல் ஹியூமிகான் மோடு ஆன் செய்யவும்.,படுக்கேரையே சிட்டுவை ஆன் செய்யவும்,0.8889,0.6327,11.11,36.73,base,2026-03-05T11:29:45.427281+00:00
sarvam,tamil,tamil_51.wav,படுக்கையறை AC இல் சைல்ட் லாக் மோடு ஆஃப் செய்யவும்.,படுக்கையை ஏசி்டுவில் வெடிக்கல் சுவிங்களை 4 அகவும் அரி சண்டல் சுவிங்களை 3 அகவும் மமைக்கவும்,1.0,1.0,0.0,0.0,base,2026-03-05T11:29:48.355087+00:00
sarvam,tamil,tamil_52.wav,படுக்கையறை AC இல் ஈகோ மோடு ஆன் செய்யவும்.,படுக்கேறையே சிப்பட்டுவில் இக்கோ மோடு அன்சையும்,0.8571,0.6098,14.29,39.02,base,2026-03-05T11:29:50.387253+00:00
sarvam,tamil,tamil_53.wav,படுக்கையறை AC இல் லைட் இன்டென்சிட்டி லோ ஆக அமைக்கவும்.,"படுக்கேரா AC 2-0 fan, வேகத்தை மிடியமாக மிகவும்",0.875,0.5926,12.5,40.74,base,2026-03-05T11:29:59.457345+00:00
elevenlabs,tamil,tamil_0.mp3,படுக்கையறை ஏர் ப்யூரிஃபையர் 1 ஐ இயக்கவும்.,படுக்கையாக ஏற்பியும் ஒன்னையே கவும்,1.0,0.5,0.0,50.0,base,2026-03-05T11:30:01.486057+00:00
elevenlabs,tamil,tamil_1.mp3,படுக்கையறை ஏர் ப்யூரிஃபையர் 1 இல் பஸ்சர் கட்டுப்பாட்டை இயக்கவும்.,படுக்கையாக் ஏற்பியும் ஓனில் பாசர் கட்டுப்பாட்டையக் கவும்,1.0,0.3538,0.0,64.62,base,2026-03-05T11:30:03.869891+00:00
elevenlabs,tamil,tamil_10.mp3,படுக்கையறை ஏர் ப்யூரிஃபையர் 1 இல் பேன் வேகம் 4 அமைக்கவும்.,ஒன்று வரையே பிறிவியர் One IEI Kavum.,1.0,0.7931,0.0,20.69,base,2026-03-05T11:30:05.908483+00:00
elevenlabs,tamil,tamil_11.mp3,படுக்கையறை ஏர் ப்யூரிஃபையர் 1 இல் நைட் மோடு அமைக்கவும்.,உன்னும் வரை ஏற்பியும் ஓன்னில் ரிங் LED Brightness ஏறிபது அமைக்கவும்,1.0,0.8182,0.0,18.18,base,2026-03-05T11:30:09.704801+00:00
elevenlabs,tamil,tamil_12.mp3,படுக்கையறை ஏர் ப்யூரிஃபையர் 1 இல் 60 நிமிட ஸ்விட்ச் ஆஃப் டைமரை அமைக்கவும்.,உனக்கு வரை யார் பியும் ஓன்னில் ஏற்று பாரையைக் கவும்,1.0,0.6486,0.0,35.14,base,2026-03-05T11:30:12.881525+00:00
elevenlabs,tamil,tamil_13.mp3,படுக்கையறை ஏர் ப்யூரிஃபையர் 1 இல் ரிங் எல்இடி பிரைட்ட்னஸ் 40 ஆக அமைக்கவும்.,உனக்கு வரையிர் பிறிப்புறியும் ஒன்னில் Night Mode அமைக்கவும்,1.0,0.64,0.0,36.0,base,2026-03-05T11:30:16.072358+00:00
elevenlabs,tamil,tamil_14.mp3,படுக்கையறை ஏர் ப்யூரிஃபையர் 1 இல் டர்போ மோடு இயக்கி பஸ்சர் கட்டுப்பாட்டை அணைக்கவும்.,ஒன்று வரை ஏற்பியும் பிறிவியாக ஒன்னில் நோத்தின் இன்பதனிமிடு Switch of Time-Rai அமைக்கவும்,1.0,0.7976,0.0,20.24,base,2026-03-05T11:30:21.063015+00:00
elevenlabs,tamil,tamil_15.mp3,படுக்கையறை ஏர் ப்யூரிஃபையர் 1 இல் 720 நிமிட ஸ்விட்ச் ஆஃப் டைமரை அமைக்கவும்.,உனக்கு வரையிர் பிரியும் ஒன்று யில் பார்த்தையையைக்குவம்.,1.0,0.6533,0.0,34.67,base,2026-03-05T11:30:25.433830+00:00
elevenlabs,tamil,tamil_16.mp3,உணவறையில் ஏர் ப்யூரிஃபையரை இயக்கவும்.,உனவரை யார் பிறிப்பயற்ற ஒன்றில் தான் வேகம் மூன்று அமைக்கவும்,1.0,1.0,0.0,0.0,base,2026-03-05T11:30:28.990858+00:00
elevenlabs,tamil,tamil_17.mp3,என் படுக்கையறை ஏர் ப்யூரிஃபையர் 1 இன் நிலை என்ன?,உன வரையேர் பியும் இருக்கும்,1.0,0.7292,0.0,27.08,base,2026-03-05T11:30:37.868486+00:00
elevenlabs,tamil,tamil_18.mp3,உணவறை ஏர் ப்யூரிஃபையர் 1 ஐ இயக்கவும்.,"உன வரையே பیورிப்பயற் 1-0,ரிங்,லிடிப் பிரியத்து இரணுட்டுது அக்கா அமைக்கவும்.",1.0,1.0,0.0,0.0,base,2026-03-05T11:30:43.626263+00:00
elevenlabs,tamil,tamil_19.mp3,உணவறை ஏர் ப்யூரிஃபையர் 1 இல் ரிங் எல்இடி பிரைட்ட்னஸ் 70 அமைக்கவும்.,உனக்கு வரை ஏற்பியும் பிரியும் நூரியில் நோட்டி எண்பதனிமிடு சுவ்விட்டும் நிறுவிட்டும் நிறுவிட்டும் அமைக்கவும்,1.0,1.0,0.0,0.0,base,2026-03-05T11:30:49.132326+00:00
elevenlabs,tamil,tamil_2.mp3,உணவறை ஏர் ப்யூரிஃபையர் 1 இல் ஹீட்டர் பவரை இயக்கவும்.,படக்கையை ஏற்பியும் ஒன்னில் வேகம் நாள்கள் அமைக்கவும்,1.0,0.6923,0.0,30.77,base,2026-03-05T11:30:51.822061+00:00
elevenlabs,tamil,tamil_20.mp3,உணவறை ஏர் ப்யூரிஃபையர் 1 இல் நைட் மோடு அமைக்கவும்.,வாசிப் பரையே பிவிவிட்டில் ஒன்னையையக்கவும்,1.0,0.68,0.0,32.0,base,2026-03-05T11:30:54.435543+00:00
elevenlabs,tamil,tamil_21.mp3,உணவறை ஏர் ப்யூரிஃபையர் 1 இல் 180 நிமிட ஸ்விட்ச் ஆஃப் டைமரை அமைக்கவும்.,மசிப்பாரை ஏற்பியும் பிறிவியாக ஒன்னில் அருப்பது நிமிடம் சுவ்விட்டாய் மரை அமைக்கவும்,1.0,0.7,0.0,30.0,base,2026-03-05T11:30:57.948251+00:00
elevenlabs,tamil,tamil_22.mp3,உணவறை ஏர் ப்யூரிஃபையர் 1 இல் பஸ்சர் கட்டுப்பாட்டை இயக்கவும்.,بசிப்பரையேர் பிறிவிர் ஒன்றியில் Night Mode YAKAVUM.,1.0,0.8167,0.0,18.33,base,2026-03-05T11:31:00.261507+00:00
elevenlabs,tamil,tamil_23.mp3,உணவறை ஏர் ப்யூரிஃபையர் 1 இல் பேன் வேகம் 3 அமைக்கவும்.,"பாசிப் பரை, Air Purifier 1 in BAN POWERY ANEKKAMUM.",1.0,0.8491,0.0,15.09,base,2026-03-05T11:31:02.579404+00:00
elevenlabs,tamil,tamil_24.mp3,உணவறை ஏர் ப்யூரிஃபையர் 1 ஐ இயக்கவும்.,வசிப்பரை யார் பிறிப்பாய் ஒன்றில் பான் பாவிரையைக்கின் பான் வேகம் நார் அமைக்கவும்,1.0,1.0,0.0,0.0,base,2026-03-05T11:31:06.046953+00:00
elevenlabs,tamil,tamil_25.mp3,உணவறை ஏர் ப்யூரிஃபையர் 1 இல் ரிங் எல்இடி பிரைட்ட்னஸ் 200 ஆக அமைக்கவும்.,Living Room Year Purifier 1-0 fanwagatthai Yattagamikavum,1.0,0.9296,0.0,7.04,base,2026-03-05T11:31:07.908453+00:00
elevenlabs,tamil,tamil_26.mp3,உணவறை ஏர் ப்யூரிஃபையர் 100 இல் 180 நிமிட ஸ்விட்ச் ஆஃப் டைமரை அமைக்கவும்.,Living Room Year Purifier 1 I Anekavum,1.0,0.9167,0.0,8.33,base,2026-03-05T11:31:09.542124+00:00
elevenlabs,tamil,tamil_27.mp3,வசிப்பறை ஏர் ப்யூரிஃபையர் 1 ஐ இயக்கவும்.,ஏற்று பியோர் ஒன்னை அனைக்கவும்,1.0,0.625,0.0,37.5,base,2026-03-05T11:31:11.448885+00:00
elevenlabs,tamil,tamil_28.mp3,வசிப்பறை ஏர் ப்யூரிஃபையர் 1 இல் 60 நிமிட ஸ்விட்ச் ஆஃப் டைமரை அமைக்கவும்.,"Living Room Air Purifier 1 NIL, Fan Wégathay, இரண்டாக அமைக்கவும்.",0.9091,0.7222,9.09,27.78,base,2026-03-05T11:31:13.748007+00:00
elevenlabs,tamil,tamil_29.mp3,வசிப்பறை ஏர் ப்யூரிஃபையர் 1 இல் நைட் மோடு இயக்கவும்.,என் படக்கையாக் கில் என்ன சாதனங்கள் உள்ளனும்,1.0,0.7885,0.0,21.15,base,2026-03-05T11:31:15.867081+00:00
elevenlabs,tamil,tamil_3.mp3,வசிப்பறை ஏர் ப்யூரிஃபையர் 1 இன் பேன் பவரை அணைக்கவும்.,படக்கையிரை ஏற்பிவிருவன்னில் நில்ணை மோட அமைக்கவும்,1.0,0.6604,0.0,33.96,base,2026-03-05T11:31:18.456580+00:00
elevenlabs,tamil,tamil_30.mp3,வசிப்பறை ஏர் ப்யூரிஃபையர் 1 இல் பேன் பவரை இயக்கி பேன் வேகம் 4 அமைக்கவும்.,படுக்கையிரையில ACI ONCEYIVUM,1.0,0.863,0.0,13.7,base,2026-03-05T11:31:20.349857+00:00
elevenlabs,tamil,tamil_31.mp3,லிவிங் ரூம் ஏர் ப்யூரிஃபையர் 1 இல் ஃபேன் வேகத்தை 8 ஆக அமைக்கவும்.,"படுக்கையிரை A-C-L, WEP-PED-18-DIGERY-A-MIC-CABOOM.",1.0,0.9231,0.0,7.69,base,2026-03-05T11:31:22.776647+00:00
elevenlabs,tamil,tamil_32.mp3,லிவிங் ரூம் ஏர் ப்யூரிஃபையர் 1 ஐ அணைக்கவும்.,"படக்கையிரை A-C-L, D-Splay Mode On-Sayabum.",1.0,0.9318,0.0,6.82,base,2026-03-05T11:31:24.930003+00:00
elevenlabs,tamil,tamil_33.mp3,லிவிங் ரூம் ஏர் ப்யூரிஃபையர் 1 ஐ அணைக்கவும்.,Δ Dieser ر bracket werden ஒ shrimp விடворfu விடיל பிட்ட வேCI場Pathing Nope.,1.0,1.0,0.0,0.0,base,2026-03-05T11:31:42.443138+00:00
elevenlabs,tamil,tamil_34.mp3,லிவிங் ரூம் ஏர் ப்யூரிஃபையர் 1 இல் ஃபேன் வேகத்தை 2 ஆக அமைக்கவும்.,iénேfitாக そத்திருந்துப் பிடித்தேன் மாக்திற்கு வகத்துக்கொளியெடுவும்,1.0,0.7846,0.0,21.54,base,2026-03-05T11:31:56.976747+00:00
elevenlabs,tamil,tamil_35.mp3,என் படுக்கையறையில் என்ன சாதனங்கள் உள்ளன?,படக்கையை ஏ சில் dry மோடு அமைக்கவும்,1.0,0.75,0.0,25.0,base,2026-03-05T11:31:59.100676+00:00
elevenlabs,tamil,tamil_36.mp3,படுக்கையறையில் AC ஐ ஆன் செய்யவும்.,படுக்கையிரை A-seal Sleep Mode On.,1.0,0.6471,0.0,35.29,base,2026-03-05T11:32:00.853822+00:00
elevenlabs,tamil,tamil_37.mp3,படுக்கையறை AC இல் வெப்பநிலையை 18 டிகிரியாக அமைக்கவும்.,"படுக்கையிரை ACL, வாட்டிக்கல் சுவிங்களை அந்த அக்காமைக்கவும்",1.0,0.6111,0.0,38.89,base,2026-03-05T11:32:03.578189+00:00
elevenlabs,tamil,tamil_38.mp3,படுக்கையறை AC இல் டிஸ்ப்ளே மோடு ஆன் செய்யவும்.,படக்கையிரை A-seal Sky High Color On Siyabu.,1.0,0.7174,0.0,28.26,base,2026-03-05T11:32:05.552786+00:00
elevenlabs,tamil,tamil_39.mp3,டைனிங் ரூமில் AC ஐ ஆன் செய்யவும்.,"Living Room AC 2 I Onside, அதன Horiesondle Swing Nilae 20 Aga Amikavum",1.0,1.0,0.0,0.0,base,2026-03-05T11:32:07.672881+00:00
elevenlabs,tamil,tamil_4.mp3,ஆபிஸ் AC 2 ஐ ஆன் செய்யவும்.,படக்கையை ஏற்பியும் ஓன்னில் அர்பதனிமேடையும் சுவ்வுடன் பிறகுத்தான் மறைக்கவும்,1.0,1.0,0.0,0.0,base,2026-03-05T11:32:11.264149+00:00
elevenlabs,tamil,tamil_40.mp3,படுக்கையறை AC இல் டிரை மோடு அமைக்கவும்.,L Unterschied KELLforce B,1.0,0.9231,0.0,7.69,base,2026-03-05T11:32:21.449025+00:00
elevenlabs,tamil,tamil_41.mp3,படுக்கையறை AC இல் ஸ்லீப் மோடு ஆன் செய்யவும்.,"படக்கையிரை A-C-L, Chyl-Lock on-Sayevum.",1.0,0.7273,0.0,27.27,base,2026-03-05T11:32:23.594694+00:00
elevenlabs,tamil,tamil_42.mp3,படுக்கையறை AC இல் வெர்டிக்கல் ஸ்விங் நிலை 5 ஆக அமைக்கவும்.,அவள் ஆக்கும் வார்ந்துக்கொள்ளுக்கும் வேகத்தையாக அமைக்குவம்.,1.0,0.6724,0.0,32.76,base,2026-03-05T11:32:26.347372+00:00
elevenlabs,tamil,tamil_43.mp3,படுக்கையறை AC இல் ஸ்கை ஹை கலர் ஆன் செய்யவும்.,படுக்கையிரையே சீயில் Hori Sondalswing auto-agga amikavu.,1.0,0.8889,0.0,11.11,base,2026-03-05T11:32:28.585541+00:00
elevenlabs,tamil,tamil_44.mp3,லிவிங் ரூம் AC 2 ஐ ஆன் செய்து அதன் ஹாரிசொண்டல் ஸ்விங் நிலை 2 ஆக அமைக்கவும்.,levnym a-c2 ile Waipani Ley معическойкers ப running 9 bird aison,1.0,0.8933,0.0,10.67,base,2026-03-05T11:32:39.180691+00:00
elevenlabs,tamil,tamil_45.mp3,லிவிங் ரூம் AC 2 இல் டர்போ மோடு ஆன் செய்யவும்.,யோகா ஓம் AC1N onSaidhu அதன் свich off-time-ray 20 நிமிடமாக அமைக்கவும்,1.0,1.0,0.0,0.0,base,2026-03-05T11:32:41.885006+00:00
elevenlabs,tamil,tamil_46.mp3,படுக்கையறை AC இல் சைல்ட் லாக் ஆன் செய்யவும்.,யோகாரும் AC1NIL HUMICON MODE ONCEYIVUM,1.0,0.8636,0.0,13.64,base,2026-03-05T11:32:44.059033+00:00
elevenlabs,tamil,tamil_47.mp3,ஆபிஸ் AC 2 இல் ஃபேன் வேகத்தை ஹை ஆக அமைக்கவும்.,"படுக்கையிரை, ஏ செய்லாக மோட்டு அவசையவும்.",1.0,0.7609,0.0,23.91,base,2026-03-05T11:32:46.407521+00:00
elevenlabs,tamil,tamil_48.mp3,படுக்கையறை AC இல் ஹாரிசொண்டல் ஸ்விங் ஆட்டோ ஆக அமைக்கவும்.,படுக்கையிரையே செயல் இங்குமோடு அன்சையவும்,1.0,0.614,0.0,38.6,base,2026-03-05T11:32:48.771319+00:00
elevenlabs,tamil,tamil_49.mp3,லிவிங் ரூம் AC 2 இல் வெப்பநிலையை 30 டிகிரியாக அமைக்கவும்.,படுக்கையிரை ACL Light Intensity Low Aga Amikavum,1.0,0.8947,0.0,10.53,base,2026-03-05T11:32:50.673895+00:00
elevenlabs,tamil,tamil_5.mp3,யோகா ரூம் AC 1 ஐ ஆன் செய்து அதன் ஸ்விட்ச் ஆஃப் டைமரை 20 நிமிடமாக அமைக்கவும்.,படுக்கையிரை ஏற்பியும் பிறிவிர் 1-0-RING L.E.D. Brightness 40-Yaga AMI-Kavum,1.0,0.9474,0.0,5.26,base,2026-03-05T11:32:53.608856+00:00
elevenlabs,tamil,tamil_50.mp3,யோகா ரூம் AC 1 இல் ஹியூமிகான் மோடு ஆன் செய்யவும்.,படக்கையிரை AC2I ONCE EVUM,1.0,0.8776,0.0,12.24,base,2026-03-05T11:32:55.380740+00:00
elevenlabs,tamil,tamil_51.mp3,படுக்கையறை AC இல் சைல்ட் லாக் மோடு ஆஃப் செய்யவும்.,படக்கையாக ஏசி இரண்டியில விற்றிக்கல ச் வீங்களை நாராகவும் வாருஷோண்டுல ச் வீங்களை மூன்றாகவும் அமைக்கவும்,1.0,1.0,0.0,0.0,base,2026-03-05T11:32:59.480220+00:00
elevenlabs,tamil,tamil_52.mp3,படுக்கையறை AC இல் ஈகோ மோடு ஆன் செய்யவும்.,படக்கையிரை AC இரண்டில இங்கோ மோடு அன்சையவும்,0.7143,0.4146,28.57,58.54,base,2026-03-05T11:33:01.739002+00:00
elevenlabs,tamil,tamil_53.mp3,படுக்கையறை AC இல் லைட் இன்டென்சிட்டி லோ ஆக அமைக்கவும்.,படுக்கையிரை AC இரண்டில் FAN வேதத்தை மீடியமாக அமைக்கவும்,0.875,0.5,12.5,50.0,base,2026-03-05T11:33:04.392030+00:00
sarvam,telugu,telugu_0.wav,పడకగది ఎయిర్ ప్యూరిఫైయర్ 1 ను ఆన్ చేయండి।,picadali tek食ar Sawat,1.0,0.9512,0.0,4.88,base,2026-03-05T11:33:20.777468+00:00
sarvam,telugu,telugu_1.wav,పడకగది ఎయిర్ ప్యూరిఫైయర్ 1 లో బజర్ నియంత్రణను ఆన్ చేయండి।,P darkagidhi yeyyyoh purruithoer one lobuzor ne entranu болin,1.0,1.0,0.0,0.0,base,2026-03-05T11:33:32.215757+00:00
sarvam,telugu,telugu_10.wav,పడకగది ఎయిర్ ప్యూరిఫైయర్ 1 లో ఫ్యాన్ వేగాన్ని 4 గా సెట్ చేయండి।,Dining Room Air Purifier 1NO ONCH ENDE,1.0,0.9048,0.0,9.52,base,2026-03-05T11:33:33.979857+00:00
sarvam,telugu,telugu_11.wav,పడకగది ఎయిర్ ప్యూరిఫైయర్ 1 లో నైట్ మోడ్ సెట్ చేయండి।,Dining Room Air Purify 1 Loring LED Procarsham 77.,1.0,0.9038,0.0,9.62,base,2026-03-05T11:33:35.621277+00:00
sarvam,telugu,telugu_12.wav,పడకగది ఎయిర్ ప్యూరిఫైయర్ 1 లో 60 నిమిషాల స్విచ్ ఆఫ్ టైమర్ సెట్ చేయండి।,Dining Room Air Purifier 1-No heater power-on-chain.,1.0,0.9286,0.0,7.14,base,2026-03-05T11:33:37.312571+00:00
sarvam,telugu,telugu_13.wav,పడకగది ఎయిర్ ప్యూరిఫైయర్ 1 లో రింగ్ ఎల్ఈడి ప్రకాశం 40 గా సెట్ చేయండి।,Dining Room Air Purify 10 Night Mode Set Chayendi,1.0,0.8841,0.0,11.59,base,2026-03-05T11:33:39.048538+00:00
sarvam,telugu,telugu_14.wav,పడకగది ఎయిర్ ప్యూరిఫైయర్ 1 లో టర్బో మోడ్ ఆన్ చేసి బజర్ నియంత్రణ ఆఫ్ చేయండి।,Digning room aid purifair 1 low 120 Unbelievable switch of timer SetKND,1.0,0.92,0.0,8.0,base,2026-03-05T11:33:50.043459+00:00
sarvam,telugu,telugu_15.wav,పడకగది ఎయిర్ ప్యూరిఫైయర్ 1 లో 720 నిమిషాల స్విచ్ ఆఫ్ టైమర్ సెట్ చేయండి।,Dining room air purifier 1mm Bazaar niyantra na anche endi.,1.0,0.9014,0.0,9.86,base,2026-03-05T11:33:52.123904+00:00
sarvam,telugu,telugu_16.wav,డైనింగ్ రూమ్ లో ఎయిర్ ప్యూరిఫైయర్ ఆన్ చేయండి।,Dining Room 8 Purifier 1 Lough Fan Vegam 3 7 Chendi,1.0,1.0,0.0,0.0,base,2026-03-05T11:33:53.826915+00:00
sarvam,telugu,telugu_17.wav,నా పడకగది ఎయిర్ ప్యూరిఫైయర్ 1 స్థితి ఏమిటి?,Dining Room Air Pure Fair 1 No Unchainedi,1.0,0.907,0.0,9.3,base,2026-03-05T11:33:58.564226+00:00
sarvam,telugu,telugu_18.wav,డైనింగ్ రూమ్ ఎయిర్ ప్యూరిఫైయర్ 1 ను ఆన్ చేయండి।,Dining Room i Purifier 1 Low Ring LDD Procarsham 200 Set Chain D.,1.0,1.0,0.0,0.0,base,2026-03-05T11:34:00.385468+00:00
sarvam,telugu,telugu_19.wav,డైనింగ్ రూమ్ ఎయిర్ ప్యూరిఫైయర్ 1 లో రింగ్ ఎల్ఈడి ప్రకాశం 70 సెట్ చేయండి।,Dining Room Air Purifier 100 Lowe 180 Nm switch off Time Set Chayandi.,1.0,0.9306,0.0,6.94,base,2026-03-05T11:34:02.328796+00:00
sarvam,telugu,telugu_2.wav,డైనింగ్ రూమ్ ఎయిర్ ప్యూరిఫైయర్ 1 లో హీటర్ పవర్ ఆన్ చేయండి।,پڑکگدی ایر پیری فیر one low fan vegan 4 ga set chaendi.,1.0,0.8793,0.0,12.07,base,2026-03-05T11:34:06.214338+00:00
sarvam,telugu,telugu_20.wav,డైనింగ్ రూమ్ ఎయిర్ ప్యూరిఫైయర్ 1 లో నైట్ మోడ్ సెట్ చేయండి।,Living room 8 purifier 1 no on chain.,0.9,0.8621,10.0,13.79,base,2026-03-05T11:34:07.983309+00:00
sarvam,telugu,telugu_21.wav,డైనింగ్ రూమ్ ఎయిర్ ప్యూరిఫైయర్ 1 లో 180 నిమిషాల స్విచ్ ఆఫ్ టైమర్ సెట్ చేయండి।,Living room air purifier 1 low 16 emishala switch of timer set chandy.,0.9231,0.8442,7.69,15.58,base,2026-03-05T11:34:09.837510+00:00
sarvam,telugu,telugu_22.wav,డైనింగ్ రూమ్ ఎయిర్ ప్యూరిఫైయర్ 1 లో బజర్ నియంత్రణ ఆన్ చేయండి।,"aderships,vacation &",1.0,0.9836,0.0,1.64,base,2026-03-05T11:34:32.568464+00:00
